,ID,text,tag_tamara,tag_katja,comments_tamara,comments_katja,flagged_tamara,flagged_katja,chair,final_tag,sent_tamara,sent_katja
0,ParlaMint-SI_2013-10-21-SDZ6-Redna-18.u63,Hvala. Besedo dajem gospodu Samu Omerzelu.,P_Neutral,P_Neutral,Procedural,,,,True,P_Neutral,Neutral,Neutral
1,ParlaMint-SI_2010-12-23-SDZ5-Izredna-36.u69,"Hvala lepa. Končali smo s predstavitvijo stališč poslanskih skupin. Prehajamo na razpravo poslank in poslancev. Prosim vas, da to razpravo opravljamo na način, kot je običajno v tem Državnem zboru, ne pa iz klopi z vpitjem na eno in drugo stran. Besedo ima gospa poslanka Melita Župevc. Izvolite.",N_Neutral,N_Neutral,Could be negative,,,,True,N_Neutral,Neutral,Neutral
2,ParlaMint-SI_2020-10-15-SDZ8-Izredna-46.u33,"Glejte, gospa [[…]] [[oglašanje iz dvorane]]",N_Neutral,P_Neutral,We don't know what this is but negative.,,,,True,,Neutral,Neutral
3,ParlaMint-SI_2010-11-17-SDZ5-Redna-22.u106,"Hvala lepa. Glasujemo. Prekinjam. Prosim, gospa Zalokar?",P_Neutral,P_Neutral,Procedural,,,,True,P_Neutral,Neutral,Neutral
4,ParlaMint-SI_2005-10-26-SDZ4-Redna-10.u151,"Hvala lepa. In še kot zadnjega vabim k besedi dr. Gantarja, da predstavi stališče LDS.",P_Neutral,P_Neutral,Procedural,,,,True,P_Neutral,Neutral,Neutral
5,ParlaMint-SI_2019-03-25-SDZ8-Redna-06.u38,"Dajem postopkovni predlog, da Državni zbor opravi razpravo o odgovoru predsednika Vlade, morda natančneje o neodgovoru predsednika vlade. Revščina v naši družbi, bogati družbi je sramota. Medtem ko si lastniki kapitala izplačujejo bajne dobičke, veliki del naših državljank in državljanov živi pod ravnjo dostojnega življenja. In ko pravim, da je revščina sramota, to ni sramota za tistega, ki živi v revščini, to je sramota za oblast, ki tovrstno neenakost v družbi dopušča. Še posebej, če se pogovarjamo o revščini starejših, o revščini upokojencev, ki so prispevali svojih 40 in več let delovne aktivnosti v to družbo, nazaj pa ne dobijo niti 500, niti 600 evrov. Še več, s privatizacijsko strategijo oskrbe v domovih starejših občanov se je postavil mehanizem domske oskrbe, ki ne temelji na solidarnosti, ampak temelji na zaslužkarstvu zasebnikov. In če kaj, je ravno to temeljna stvar, v kateri bi se moral Državni zbor pogovarjati, da odpravi krivice, ki so zadele upokojence v kriznem varčevanju in da začne s to množico upokojencev. 240 tisoč je takih, ki živi z manj kot 600 evrov, dvigati iz revščine, ker si zaslužijo več in si zaslužijo boljše. Hvala.",Negative,Negative,Charged and demanding for a change. ,"The speaker gives a proposal, where he describes a very negative topic. While the end is slightly less negative, the words used and the accusatory tone makes me think that this is fully negative. But could also be M_Positive, due to the end sentence.",,1.0,False,Negative,Negative,Negative
6,ParlaMint-SI_2012-11-15-SDZ6-Izredna-20.u162,V imenu Poslanske skupine Pozitivna Slovenija mag. Stanko Stepišnik.,P_Neutral,P_Neutral,Procedural,,,,True,P_Neutral,Neutral,Neutral
7,ParlaMint-SI_2002-03-20-SDZ3-Redna-14.u70,"Hvala lepa. Na predhodnem sklicu aprilske seje je tudi predlog zakona o uresničevanju javnega interesa za kulturo v prvi obravnavi, ki pravzaprav odpira ta vprašanja, ki ste jih danes nekateri poslanci, predvsem pa predlagatelji amandmaja k 80.b členu, v veliki meri poskušali že načeti. Rada bi opozorila na dejstvo, da člen zakona, pri katerem smo danes, govori o načelu odplačnosti odtujitve. Člen zakona, s katerim se bomo srečali in ki pravzaprav zajema vso materijo, ki se danes odpira, pa govori - govorim o krovnem kulturniškem zakonu -, pa govori o prenosu ustanoviteljskih pravic in obveznosti. Ta člen pravzaprav rešuje to materijo, ki jo danes predhodno po hitrejše izvajanem postopku rešuje ta zakon. Seveda ostaja in obstaja vprašanje, zakaj ni mogoče počakati nekaj mesecev, dvomim da celo leto, in pohiteti z neko rešitvijo, ki, če repliciram kolega Kremžarja, zagotovo je pisana na ime enega zavoda. Bojim se in v tem kontekstu se mi zdi, da se skozi premičninske oziroma lastniške prenose na nek način diktirajo in potem tudi že sugerirajo neka druga vprašanja, ki se dotikajo ustanoviteljskih, ki bi prehitevali. Ta vprašanja niso tako enostavna. Ta vprašanja so pravzaprav vprašanja, zaradi katerih je tako rekoč nedavno od tega bil vložen razmislek o delu enega ministra, ki se mu je očitalo, da deluje centralistično. Bojim se, da rešitve, ki so v ozadju in v videnju teh predlogov, so tudi zelo centralistične, ker pomenijo, da se lastnine - dobro, lahko je tudi drugačen vrstni red - ampak predvsem, da se lastnina občin prenaša v breme ali pa v last države. Ob tem ne velja pozabiti, da se pri vsakem prenosu izstavljajo tudi računi, da ne govorim seveda še o obveznostih, pravicah in dolžnostih, ki jih posledično imajo. Ampak ne bi hotela replicirati in niti ne razpravljati o temi, o kateri se bomo bolj poglobljeno srečevali na aprilski, upam, seji. Hvala.",Negative,N_Neutral,"Lots of negatives or unanswered questions, concerns. ","Speaker outlines the basic characteristics of the proposed legislation, while stayng relatively neutral, with slight connotations to the negative.",,,False,,Negative,Neutral
8,ParlaMint-SI_2017-06-21-SDZ7-Redna-31.u12,"Hvala za besedo, gospod predsednik. Spoštovane kolegice in kolegi! Nepovezani poslanec Andrej Čuš je v začetku letošnjega leta v parlamentarno proceduro vložil novelo Zakona o organizaciji in financiranju vzgoje in izobraževanja, katere cilj je vključitev diplomantov in magistrantov študijskega programa Biopsihologija med nabor svetovalnih delavcev vzgoje in izobraževanja, kot to določa 67. člen veljavnega zakona. V Poslanski skupini Stranke modernega centra ocenjujemo, da so naloge svetovalne službe ključnega pomena za uspešno delovanje in razvoj vzgojno-izobraževalnih ustanov, zato ni nepomembno, kdo takšno delo opravlja. Ravno iz teh potreb po visoki kakovosti zagotavljanja dela svetovalne službe spada poklic svetovalnega delavca v vzgoji in izobraževanju med regulirane poklice. Naj poudarim, da do takšnih težav, s katerimi se soočamo v primeru biopsihologov, v prihodnje več ne bo prihajalo, ker to na zakonodajni ravni ne bo več mogoče. V lanskem letu sprejeta novela Zakona o visokem šolstvu jasno določa, da si mora Nacionalna agencija za kakovost v visokem šolstvu pri akreditaciji študijskih programov za regulirane poklice pridobiti soglasje ministrstva, v katerega pristojnost sodi poklic, ki ga bo pridobil diplomant. S sprejetim zakonom se je tudi povečala odgovornost visokošolskih zavodov za spremembe in večjo fleksibilnost študijskih programov, zaostrili so se pogoji za ustanavljanje in delovanje visokošolskih zavodov, zaradi neusklajenosti ter premajhne povezanosti med visokim šolstvo in trgom dela pa so vzpostavljene pravne podlage za namene analiziranja zaposljivosti diplomantov, prav tako pa se je kriterij zaposljivosti uvedel v enega od elementov financiranja študijske dejavnosti. Danes je pravzaprav vidno, kako močno je visokošolski prostor potreboval te spremembe. Študijski program Biopsihologija je torej javnoveljavni študijski program s podeljeno akreditacijo na prvi in drugi stopnji. Narobe je, ko govorimo, da so diplomanti biopsihologije nezaposljivi, saj to ne drži. Zaposljivi so med drugim tudi v javnem sektorju z izjemo določenih poklicnih področij, kjer se je država odločila za njihovo regulacijo. Problem, s katerim se danes pravzaprav soočamo, je problem praznih obljub in zavajanja mladih študentov, ki so verjeli v to, da se bodo po končanem študiju lahko zaposlili znotraj reguliranih poklicev na področju šolstva, seveda tudi sociale in zdravstva. Sprašujemo se, zakaj NAKVIS ni izvedel izredne evalvacije študijskega programa. Sprašujemo se o odgovornosti fakultete, ki je program predlagala, in ne nazadnje se glede na opozorila stroke, ki smo ji bili priča na seji matičnega delovnega telesa, sprašujemo tudi o ustreznosti in zadostnosti kompetenc biopsihologov, ki jih ti pridobijo tekom študija in ki bi jim omogočale opravljanje dela na področju vzgoje in izobraževanja. Problem je torej nastal znotraj odgovornih visokošolskih institucij, ki ga morajo tudi same ustrezno nasloviti in rešiti. Pravzaprav je rešitev jasna: preoblikovati študijski program na način, da bodo študenti pridobili zadostne kompetence, da se bodo lahko zaposlili tudi na področju reguliranih poklicev. V Poslanski skupini Stranke modernega centra smo poskušali biti pri presojanju o podpori oziroma nepodpori zakonu objektivni. Pozorni smo bili na mnenja stroke, saj je razrešitev tega problema, kot smo že danes slišali, v prvi vrsti strokovno vprašanje. Predloga zakona nismo podprli, apeliramo pa na vse odgovorne in predvsem pristojne, da poiščejo rešitev za zatečeno stanje predvsem v korist študentk in študentov. Hvala.",M_Negative,M_Negative,"Non support of suggested, but also aspires and requestsa positive change. ","In the first part relatively neutral (with slight exception of positive opinion of the necessity of the profession) but then explicitly stating disagreement with the proposed legislation at the end. It is definetly not neutral, but the very clear negative sentiment at the end, the speech could also be classfied as Negative as well.",,1.0,False,M_Negative,Negative,Negative
9,ParlaMint-SI_2005-05-16-SDZ4-Redna-06.u204,"Hvala lepa, gospod predsedujoči. Hvala lepa za vprašanje, gospod poslanec. Tudi osnovna šola veliko stane. To razpravo oziroma ta odgovor lahko razumem kot nek uvod v daljšo, širšo jutrišnjo razpravo na isto temo. Ukinjanje zunanjega preverjanje znanje se nanaša zgolj na prvo triado po praktično prvem delu osnovnega šolanja pri otrocih, starih osem let. Večina evropskih držav, in to velika večina evropskih držav, ne prakticira tega zunanjega preverjanja znanja: V veliki Britaniji, recimo Škotska in Anglija, pardon, Wales in Anglija, Škotska ne, Malta in pa Francija. Pa še s tem, da je Anglija napovedala, da bo ukinila zunanje preverjanje znanja po prvi triadi. Tako res zelo malo držav ostaja, ki bi poskušale na ta način preverjati, torej na zunanji način preverjati znanje otrok, zlasti pri tej starostni dobi. Menim, da so eksterci pomembni, da jih bom ohranili, da jim bomo dali neko uresničljivo obliko, o tem bomo več govorili jutri, vendar da imajo vse slabe lastnosti zunanjih oblik preverjanja znanja in imajo še veliko slabše posledice in rezultate ravno na tej najmlajši generaciji. Vsi vemo, da eksterci, če naj dajo neko koristno povratno informacijo - po prvi triadi tega ne dajejo, zlasti zaradi tega ne, ker ni značilnih razlik med njimi. Več ali manj so otroci doslej, vsaj tako pravijo rezultati, opravljali približno enako vse teste, praktično so rezultati zelo podobni in če hočemo mi neko informacijo dobiti iz tega preverjanja znanja, bi morale biti v rezultatih neke značilne razlike, teh pa ni. Tudi starši ne dobivajo takoj teh ocen in podatkov, tako da neke realne koristi od tega ni. Poleg tega pa so vrsta drugih slabosti, o katerih bomo zaradi časovne stiske nekoliko več spregovorili jutri. Nekatere države - tudi tiste najboljše, če kvaliteto merimo po rezultatih TIMSS - , pa seveda ne moremo zgolj po tem meriti kvaliteto šolskih sistemov, nimajo teh oblik preverjanja znanja v zgodnji fazi. Finska sploh nima, recimo, kot nek šolski čudež, oni opravljajo nacionalne preizkuse znanja na vzorcu, ne pa na nacionalni ravni, kar je bistvena razlika. Če nacionalni preizkus lahko da oceno, informacijo o znanju učenca, o delu učitelja ozirom oddelka, oceni šole, regije, občine in celotne populacije. Pri vzorčnem preverjanju znanja dobimo oceno samo iz slednjega, nič več. Skratka, to so nekako temeljni razlogi, ne samo denar, kakor pravite, ne samo pomanjkanje kadra, ki tudi obstaja - po sedanjem zakonu bi morali praktično celotno populacijo v naslednjem letu vključiti v opravljanje tega - in ne samo prostorsko logistični problemi. Torej, tudi drugi vsebinski razlogi so, ki so nam odsvetovali opravljanje nacionalnih preizkusov znanja pri tej prvi generaciji po prvi triadi. Mislim, da je že samo dejstvo, da ni to običajna praksa v svetu, zadosten razlog, da povzamemo to rešitev. Šolski sistemi res postajajo vedno bolj standardizirani, primerljivi med seboj in ni nobene potrebe, da bi mi uvajali nekaj posebnega, nek popolnoma nov ali pa drugačen model, kot ga poznajo v Evropi. Hvala lepa.",M_Negative,Negative,Very mixed feel. Explanatory. ,"Speech is not neutral, speaker expresses a very clear negative sentiment when it comes to the topic. While the sentiment is maybe not as strong as with other negative speeches, it is still present throughout the speech.",1.0,,False,,Negative,Negative
10,ParlaMint-SI_2014-08-01-SDZ7-Redna-01.u6,"Hvala lepa za besedo, spoštovana predsedujoča. Vsem prav lep pozdrav! Mislim, da je prav, da se razčistijo vsaj zadeve, povezane s sestavo Mandatno-volilne komisije. Namreč, na predlog oziroma na razrez, ki je bil določen na tem pripravljalnem sestanku, ki ga je sklical dosedanji predsednik Državnega zbora gospod Veber, ste nam določili štiri sedeže v Mandatno-volilni komisiji. Mi smo na tej pripravljalni seji predlagali, da stranke, zastopane v tem sklicu Državnega zbora, podpišejo zavezo glede potrjevanja oziroma določitve mandatov, in sicer smo predlagali, da se vsi mandati določijo v paketu. In kot 2. točko te zaveze, da nobena izmed poslanskih skupin ne bo sprožila ali podprla naknadnih postopkov za odvzem mandata poslanca. Mi smo dali rok do srede do 12. ure, da se poslanske skupine, zastopane v tem sklicu Državnega zbora, izjasnijo. Nobena izmed poslanskih skupin te zaveze ni podpisala in mi posledično tudi nismo predlagali v Mandatno-volilno komisijo nobenega člana. 7. člen Zakona o poslancih v drugem odstavku določa, da morajo biti v Mandatno-volilni komisiji zastopani poslanci oziroma predstavniki vseh poslanskih skupin v Državnem zboru. Glede na to, da Poslanska skupina Slovenska demokratska stranka v Mandatno-volilno komisijo ni predlagala štirih članov, predlagamo, da nam pred nadaljevanjem seje dostavite pisno mnenje Zakonodajno-pravne službe glede tolmačenja te določbe Zakona o poslancih. Kajti, mnenja sem, da ta hip, ta trenutek pogoji glede zastopanosti vseh poslanskih skupin v Mandatno-volilni komisiji niso izpolnjeni. Predlagam tudi, da do takrat, dokler tega mnenja ni, prekinete sejo in da potem še odredite 45 minut za proučitev mnenja Zakonodajno-pravne službe, potem ko bo mnenje razdeljeno na klopi poslancev Državnega zbora. Predlagam predlog, da v izogib vsem nadaljnjim zapletom pri izpeljavi postopka imenovanja Mandatno-volilne komisije in potrjevanju mandatov in naknadnih postopkov volitev dobimo ustrezno mnenje Zakonodajno-pravne službe, in to preden se postopki sploh začnejo. Hvala lepa.",M_Negative,N_Neutral,"Not neutral, but also not fully sentimental in either way. So I will go with mixed, with a negative connotation. ","Speaker expresses position of their group, however, the speech itself is relatively preocedural and neutral, with slight negative connotations. However, this could also be read as hostile and defensive, i.e., Negative.",1.0,1.0,False,,Negative,Neutral
11,ParlaMint-SI_2015-03-05-SDZ7-Redna-05.u124,"Gospa podpredsednica, kolegice in kolegi, predstavnika Vlade! Dovolite, da vam posredujem stališče Poslanske skupine Desus glede Predloga zakona o spremembi Zakona o elektronskem poslovanju na trgu. Sprememba 6. člena veljavnega Zakona o elektronskem poslovanju na trgu se nanaša na pogoje, ki jih mora izpolnjevati ponudnik glede pošiljanja komercialnih sporočil. Spremenjena ureditev tega področja ne bo več zahtevala predhodnega soglasja prejemnika storitve pri pošiljanju komercialnih sporočil, ki so del informacijske družbe in jih pošilja ponudnik storitev. V primeru storitev za fizične osebe kot prejemnike bo obveznost njihovega vnaprejšnjega soglasja še vedno obstajala, saj to materijo ureja druga področna zakonodaja. Toda če bodo prejemniki storitev pravne osebe, predhodno soglasje pri pošiljanju komercialnih elektronskih sporočil ne bo več potrebno. Pričakujemo, da bo predlagana rešitev pravnim osebam precej v pomoč pri iskanju novih poslovnih priložnosti in s tem širjenju poslovanja. Ker v Poslanski skupini Desus stremimo po čim večji gospodarski aktivnosti, ki pa je pogojena tudi s prijaznim, spodbudnim in enostavnim poslovnim okoljem, menimo, da bo predlagana sprememba olajšala poslovanje podjetij pri ponujanju blaga in storitev; s tem pa omogočila večjo svobodo in intenziteto gospodarskega poslovanja. Zato v Poslanski skupini Desus predlog zakona podpiramo. Hvala lepa.",Positive,Positive,Support,,,,False,Positive,Positive,Positive
12,ParlaMint-SI_2003-02-26-SDZ3-Redna-23.u40,"Gospod Tanko je bolan, tako imamo sedaj na vrsti gospo Silvo Črnugelj, Združena lista.",P_Neutral,P_Neutral,Procedural,,,,True,P_Neutral,Neutral,Neutral
13,ParlaMint-SI_2005-03-21-SDZ4-Redna-04.u191,"Hvala lepa. Gospod minister dr. Virant, prosim.",P_Neutral,P_Neutral,Procedural,,,,True,P_Neutral,Neutral,Neutral
14,ParlaMint-SI_2021-10-08-SDZ8-Izredna-84.u96,"Hvala lepa, gospa podpredsednica. Dober dan vsem. Danes pa nas 84 dni deli do te črne obletnice, ko je vlada začela izčrpavati STA s ciljem, da jo dokrajči, in kakopak po modelu tega sovražnega prevzema. Vse v vsemu cela ta ponovna ali vnovična razprava danes kaže, da to, kaj se v zadnjih 9 mesecih dogaja z STA, da je to ne samo naša sramota, to je nacionalna sramota. Pa ne zato, ker je celotna agencija ostala in postala talec političnih samodržcev, ampak zato, ker so na enak način in po istem kopitu ugrabljene, če hočete, njihove družine in, kar je najhujše, celotna družba, ki se je začela zavedati, kam nas vse to pelje. In vse to se dogaja zaradi nekoga, ki je na vsak način hotel imeti talce, ker v slepoti in brezumju te svoje nečimrnosti noče razumeti, da ni samo nebo nad njimi ali njim, so zakoni in določila pravne države. Torej avtoritarni um tistim medijem, ki se mu ne podrejajo, očitno ne privošči ne delovanja, ne privošči niti obstoja. In novinarji, ko več ne morejo biti servilni podložniki, takrat pa jih je treba utišati, uspavati, odstraniti. Zato sedanja slovenska vlada ima namen raje pahniti Slovensko tiskovno agencijo v stečaj kot da tolerira profesionalno novinarstvo, ki je seveda totalno nasprotje pisunstvu po nareku kot ga je videti v nekaterih medijih, ki so v lasti vladajočih. Veliko se je govorilo danes o tej odločitvi vrhovnega sodišča glede financiranja STA. In jaz bom samo dodal, da je ona nedvoumna, da je Republika Slovenija dolžna financirati mesečno Slovensko tiskovno agencijo in pika. Tu nimamo kaj drugega dodajati, pravniki so povedali svoje. In na nek način vidim, da tudi državna sekretarka, ob vsem spoštovanju, in tudi kolegice in kolegi iz koalicije, ko skušajo privleči za lase neke argumente, da iščejo take malenkosti, ki niso primerljive s samim dejstvom, kaj pomeni Slovenska tiskovna agencija in kako je normalno, da se financira, kar je tudi sodišče potrdilo, da me vse to spominja na situacijo, kot da bi en direktor hotelske verige skušal utemeljiti, zakaj ena slaščičarka v enem hotelu ne bo dobila plače, ker denimo ni specificirala, koliko vaniljevega sladkorja trosi po kremšnitah. In zdaj tu smo na nek način, če moram s takimi prispodobami sploh nastopati, ampak zdi se mi, da več po stokrat izrečenih ugotovitvah ne vem več, kako pojasniti, da, vsaj vas prosim, da nehate to isto trosit, ker nima, res nima smisla. Okej, nočete priznati pravico do financiranja, ampak dajte se ne slepiti, ker postajate pravzaprav s tem smešni. In za razumevanje sodnih odločitev je potrebno prebrati kaj več kot samo prva 2 stavka in potem v nekakšnem, denimo, trumpovskem slogu razglašati to nadresnico, ki je prikrojena ekskluzivnemu političnemu marketingu, kateri seveda ima možnost, da se sliši, ampak ni ga pa treba podpirati v tem hramu demokracije. Danes je posebej jasno ali ponovno je jasno, kako zelo pomembno je bilo, da smo danes nepovezani poslancu, v času pa glasovanja za PKP 7 vztrajali z amandmajem glede Slovenske tiskovne agencije, je, ker je ta odločba danes merodajna za že izdane sodne odločbe in je zelo verjetno, da se na tem ne bo končalo, da bo tudi merodajna za vse prihajajoče, ker ta zakon, zato ker je potrjen v tem Državnem zboru in, glej ga zlomka, v času te vlade, potrjuje oziroma veleva, da se sredstva za Slovensko tiskovno agencijo zagotavljajo brez izjeme. Ampak kot vidimo, vlada se izogiba ravnanju po zakonu in obenem pridiga in prisega na pravno državo, ker pravosodje je pravosodje, ko nam to ustreza, razen v primeru, ko ga imenujemo krivosodje. In kar je še bolj paradoksalno, je to, da je resnično hinavsko ob, od zahodno-balkanskih držav zahtevati, naj izpolnijo svoje pogoje glede vladavine prava in demokratičnih standardov, ko pa predsednik vlade naše države – in ne pozabimo, da je Slovenija vsem tem državam do sedaj bila najboljši vzgled – ko torej naš predsednik vlade tega ne želi storiti, ob tem ko propagira, da to zahtevamo kot Evropa od drugih. Torej priča smo temu, da je predsednik vlade k svoji nestrpnosti do objektivnega poročanja, zaradi katere kaznuje en objektivni medij, prepustil še direktorja Ukoma, da izživi neko osebno maščevalnost zaradi razhajanja z STA nekoč. In to mrcvarjenje se je začelo v slogu sadističnega discipliniranja in podrejanja. Slovenska tiskovna agencija je institucija, neposredno povezana z osamosvojitvijo Slovenije. In to bi predsednik vlade kot navzven zelo strasten domoljub moral razumeti. Moral bi jo, mislim Slovensko tiskovno agencijo, čislati, moral bi jo braniti in podpirati, ne pa da jo posiljuje in ker mu ljubezni na nek način vendarle ne izkazuje, ona mora umreti. To je tema res neke žalostinke za brata Grimm, ampak bolj se je prijela pri bratih in sestrah Grims. In ta navidezna skrb za premoženje naroda, kot je bilo izrečeno iz strani poslancev koalicije, je pravzaprav smešna ob teh nekaj podvojenih plačil za fotografije, ob vsem tem zaposlovanju na novo, na stotine novih, ki obljubljajo vdanost, za prezaposlovanje iz kleti stranke v kabinet vlade, ob neznanih 250 tisoč evrih na napotnice, ki so plačani za ne vemo kake storitve. Vse to je tudi treba premisliti, ko se v prsi tolčemo in skrbimo za premoženje naroda, ker to premoženje odteka po enih drugih kanalih veliko, veliko bolj hitro in v veliko večjem, večji količini in z veliko več škode. Jaz moram povedati, da z veliko mero sočutja pa opazujem danes pa tudi včeraj državno sekretarko kako moa zagovarjati to, kar zagovarja in kako poskuša s preskakovanjem pomembnih dejstev na neki način poudariti neke malenkosti prej sem imel prispodobo s to nesrečno slaščičarko in vaniljevim sladkorjem in kolega Trček je dal dobro iztočnico hote ali ne hote sedaj je že vseeno, da ta mitološki motiv Ifigenije je pri nas postal sindrom Ifigenije, ki se žrtvuje to je tragično res in moram reči, da to ni osamljen primer. Jaz ne vi sedaj več pozornosti usmerjal na obvezno ali nujno početje gospe državne sekretarka imajo primer tudi v naših vrstah. Moji nekdanji kolegi, čeprav smo vsi zelo zagovarjali podporo STA razen enega primera prikrite celice SDS SMC ostali so bili za so na enkrat morali obmolkniti. Vem, da v sebi tako ne čutijo, ampak neke sile so veliko bolj močne in morajo biti tiho ali vsaj vzdržani. Slovenska tiskovna agencija je nastala v času, ko je bila politika zavezana k iskanju konsenza in ko je postavljala neka nova merila, nove spodobnosti, novega poročanja v novi državi in danes za to preživetje STA 30 let po njeni ustanovitvi torej za preživetje enega od stebrov slovenske samostojnosti, zaradi psihopatoloških vzgibov najvišjih politikov mi zbiramo donacije in to je velika tragedija naše demokracije, a normalni in racionalni del slovenske družbe je izrazil jasno stališče, da Slovenska tiskovna agencija sodi v skupno dobro in deluje v javnem interesu, zato moramo znova in znova pozivati Vlado k takojšnjemu prenehanju davljenja STA, ker gre za pomemben atribut državnosti in ta je, zaradi vladnega ravnanja pred stečajem. V kateri drugi evropski državi je Vlada uničila svojo nacionalno tiskovno agencijo. Pa kaj mi res moramo biti prvi po tem? Naša Slovenska tiskovna agencija je pred stečajem kljub razsodbam sodišča kljub pomenu, ki ga ima v naši družbi kljub pozivom mednarodne skupnosti kljub razkritju, da gre za diktatorske vzgibe in danes recimo v enem od stališč poslanskih skupin kolega nacionalist pravi, da ji zameri, da ne poroča veliko o Državnem zboru in to je pravzaprav ironično, zato ker ali bi morala poročati tudi o tem po čem bo on ostal zapomnjen, da je na seji odbora predlagal kot rešitev šus v glavo za vsakega migranta, ki pride. Torej, boljše je občasno ostati tiho, ker v srednji Evropi 21. stoletja ni moč zatisniti oči ob prijemih, ki sta jih že [[nerazumljivo]]pred stoletjem opisala kot somrak civilizacije. Danes tukaj skupaj vsem nam ni treba pristati na kakršnikoli somrak razen astronomskega. STA predstavlja luč dneva slovenske demokracije, svobodnih ljudi, ki se ne bojijo represije oblasti z enoumjem pa ne bodo nič rešili. Čas mi je potekel.",Negative,Negative,"Extremly negative, charged, accusing, even derogatory. ","the last sentence is clearly  positive, the overall speech is VERY  negative. ",,,False,Negative,Negative,Negative
