,ID,text,tag_tamara,tag_katja,comments_tamara,comments_katja,flagged_tamara,flagged_katja,chair,final_tag,sent_tamara,sent_katja
86,ParlaMint-SI_2007-01-29-SDZ4-Redna-24.u33,"Hvala za besedo, gospod predsednik. Čeprav ministra gospoda Mateja danes tukaj ni, pa želim zastaviti to vprašanje predvsem zato, ker želim sporočiti slovenski javnosti, da smo zaskrbljeni in da obstajajo razlogi za to zaskrbljenost nad tem, kako deluje policija pod aktualno politično oblastjo. Namreč, v javnosti kroži dokument, zapis iz dnevnika Operativno komunikacijskega centra postojnske policije, kako policija sledi in opazuje državljane in državljanke Republike Slovenije. In zato me zanima, ali je to ustaljena praksa delovanja slovenske policije. Ker je minister Mate minister, pristojen za policijo, me zanima tudi njegovo stališče do očitkov Varuha človekovih pravic, ki je najpomembnejša inštitucija varovanja človekovih pravic v državi, ter do stališča strokovne javnosti, da gre pri takem delovanju policije za prekoračitev policijskih pooblastil in prekomerno poseganje v človekove pravice. Generalni direktor policije se sklicuje na pravne podlage za opazovanje in sledenje in na pravila policije, ki, kolikor vemo, niso objavljena v Uradnem listu, niso dosegljiva na internetu in za katera že odločba Ustavnega sodišča iz leta 2001 pove, da ta pravila niso predpis, temveč so interni akt. In to tak interni akt, ki ne vsebuje norm, ki bi povzročale pravne učinke navzven. Doslej nihče od pristojnih ni zanikal varuhovih dejanskih ugotovitev in tudi ne zapiskov, ki so prišli v javnost. Iz njih pa več kot očitno razberemo, da se je opazovanje osredotočilo na povsem konkretne osebe, bilo je dolgotrajnejše in imelo je za posledico zbiranje, evidentiranje in analiziranje osebnih podatkov. V pravni državi pa policijsko opazovanje in varovanje ni isto kot nadzorovanje. Naj spomnim, da sme policija osredotočeno nadzorovanje opravljati samo v izjemnih primerih, določenih z zakonom in odobrenih s strani tožilstva in sodišča. Zanimivo, da je generalna državna tožilka zadevo komentirala tako, da po podatkih, ki jih je Vrhovno državno tožilstvo prejelo od policije in od nekaterih tožilstev, ni nobenih razlogov za to, da bi lahko rekli, da gre za zlorabo pooblastil ali pa za tajne oziroma prikrite preiskovalne ukrepe. Ni pa denimo odgovorila, da je bila zahteva opravljena v skladu z zakonom in z odobritvijo tožilstva ali sodišča. [[...]] [[Opozorilni znak za konec razprave.]] Nam pa je seveda jasno, da policija ne bo dajala podatkov, s katerimi bi sama sebe kompromitirala oziroma samoovajala. Prosila bi za to, da minister Mate pove, kakšno je [[...]] [[Izključen mikrofon.]]",Negative,Negative,"Negative opinion, negative theme. ","Accusatory, not to mention that she was cut-off.",,,False,Negative,Negative,Negative
87,ParlaMint-SI_2009-07-16-SDZ5-Izredna-11.u283,"[[...]]vlaganj v telekomunikacijsko omrežje, za katero ni osnove v veljavni zakonodaji, nisem več oglašal. Ker pa je Poslanska skupina Slovenske demokratske stranke tako ta amandma kot številne druge amandmaje utemeljila s sredstvi iz te postavke, namreč iz te postavke smo namenjali povečevanje sredstev za malo gospodarstvo, aktivno politiko zaposlovanja, za investicije, za ceste, za zdravstvo, za kmetijstvo, šport in tudi za kulturo, kot je to v tem amandmaju. Zagotavljali izpostavke vračila vlaganj v telekomunikacijsko omrežje. Mislim, da je prav, da še enkrat pojasnimo, zakaj smo to storili. Ne zaradi tega, da bi okrnili postopek vračila vlaganj, ki preko Slovenske odškodninske družbe normalno poteka od sprejema Zakona o vračanju vlaganj v javno telekomunikacijsko omrežje dalje, ki je dober zakon, ni konfuzen, kot je bilo rečeno s strani državne sekretarke, pač pa zaradi tega, ker je gospa Helena Kamnar na Odboru za finance 23. marca ob prvi obravnavi rebalansa na moje vprašanje, če bo država nakazovala Sodu [[...]]",M_Negative,Negative,"Misiing something. Hard to say, but seems mixed, but defensive. ","Defense, but the cutoffs of the speech make it confusing.",1.0,,False,,Negative,Negative
88,ParlaMint-SI_2008-04-01-SDZ4-Redna-37.u144,"Repliciram gospodu Testenu. Mene niso zamenjali, jaz sem odstopil. [[...]] [[Oglašanje v dvorani.]] [[...]]",Negative,Negative,,"Not enough context., but seems very negative and speaker being insulted.",,1.0,False,Negative,Negative,Negative
89,ParlaMint-SI_2003-04-08-SDZ3-Izredna-30.u60,"Hvala za besedo. Ker sem bil direktno omenjen, naj še enkrat ponovim gospodu Kelemini, kaj sem povedal, ko sem govoril o predhodno opravljenih pregledih. Poglejte, predhodno opravljen pravni pregled, revizijsko poročilo poslovanja za leto 2000 in zagotovilo takratnega vodstva banke je govorilo v prid tej ideji. Še enkrat poudarjam, ideja v kontekstu - postavite se nazaj - največ ""kažina"" okoli tega, okoli nacionalnih interesov in prodaje tujih bank je bila klima, ki je kazala na to, da bi bilo dobro imeti eno banko, ki bi bila banka v rokah mesta Ljubljana, ki bi hitreje in pod ugodnejšimi pogoji kot velike banke servisirala s krediti za priključitev na sistem daljinskega ogrevanja etc., etc. Tudi skrbni pregled, ki je bil opravljen po nakupu, je pokazal, da je bila pri nakupu banke dosežena sorazmerno ugodna cena. Celo še po zadnjem cenitvenem poročilu iz marca 2002 naj bi bila tržna vrednost banke precej nad knjigovodsko in nakupno vrednostjo. SIB pa je bila tudi pod nadzorom Banke Slovenije, ki očitno vse do lanskega decembra ni odkrila nič posebno dramatičnega. O tem govorim, da je v takšnih okoliščinah prišlo do odločitve, da se v to gre. Vse zgodbe o katerih pa vi govorite danes, ki so legitimne, legalne in konkretne, naj pa raziščejo pristojni organi. Zato govorim, da je današnja točka dnevnegareda zgrešena. Zato ker govorimo že o odgovornosti, nismo pa še dobili podlage, da bi odkrili to odgovornost. Zato protestiram na ta način, da se v bistvu gremo v resnici to, kar ste vi, gospod Kelemina, rekli, lov na čarovnice. Ker mi lustriramo ljudi kar tako počez, brez da bi za to imeli podlago. Seveda lahko špekuliram in rečem, nekdo se je okoristil. Lahko celo operiram z imeni, ampak to ni pravna država. Vi govorite o pravni državi. Pravna država je, da se zberejo podatki, da se na osnovi teh podatkov sprožijo mehanizmi pregona in mehanizmi, ki govorijo o tem, da - nikogar nisem poimenoval, razen gospoda Kelemine, ko vidim, da sem povzročil [[...]]",Negative,Negative,Strong words. ,"First part does not seem AS negative as the second part, but still. Thorugh there is a brief moment in the speech that could be maybe seen as vaguely positive.",,1.0,False,Negative,Negative,Negative
90,ParlaMint-SI_2003-03-26-SDZ3-Redna-24.u64,"Hvala lepa za besedo, gospod predsednik. Ne glede na to, da predstavnika predlagatelja ni tu, v poslanski skupini Slovenske ljudske stranke ugotavljamo, da je ne glede na to, kdo je predlog zakona pripravil oziroma kdo je njegov predlagatelj, predlog zakona o pospeševanju zaposlovanja invalidov kot celota tako v namenu, ki se poistoveti v posameznih poglavjih in členih, kakor tudi v obrazložitvi, pripravljen dobro. Naše mnenje je, da bi bilo v predmetnem zakonu poleg normativnega okvirjanja pospeševanja zaposlovanja ali, bolje rečeno, zaposlovanja invalidov, dobro in potrebno doreči področje, ki je povezano z usposabljanjem invalidov za zaposlitev. To celovitost naj bi zapopadel predlog zakona, ki ga že kar dolgo pripravlja in napoveduje vlada oziroma resorno ministrstvo. Sicer ne vemo povsem natanko, kje tiči vzrok, da predlog zakona ne stopi v proceduro; najbrž je vsaj delni vzrok iskati v finančnih posledicah, ki jih bo ta zakon s seboj prinesel. Ker pa je stanje v zaposlovanju invalidov oziroma, bolje rečeno, v ohranjanju zaposlenosti invalidov nič kaj rožnato, saj se stopnja brezposelnih invalidov nezadržno veča, in kar je še bolj zaskrbljujoče, da se povečuje neohranjanje zaposlenosti že zaposlenih invalidov in se s tem povečujejo tudi socialne stiske teh ljudi. Zaradi tega ne bomo v poslanski skupini Slovenske ljudske stranke čakali na predlog vladnega zakona, temveč bomo kot dobro podlago za nadaljnjo proceduro podprli predlog zakona, o katerem danes tu na tem mestu govorimo. Vsekakor pa pričakujemo, da je povsem dobronamerno in potrebno, da kvalificirani predlagatelji,seveda v prvi vrsti vlada, pride nasproti zakonu z ustreznimi amandmaji, s katerimi bo mogoče vsebino in namen zakona dodelati v drugi obravnavi. Če pa se bo predlog kot bolj celovita obravnava tega področja pojavil s strani vlade do pričetka obravnave tega predloga, o katerem sedaj govorimo, na matičnem delovnem telesu, bomo temu primerno odločali v postopku uvrstitve, oziroma pričetku obravnave tega predloga na matičnem delavnem telesu. S tem želimo tudi neposredno pospešiti vložitev ustreznejšega, če ta ne bi bil ustrezen, predloga zakona za to področje v proceduro. Vsekakor pa mislim, da je v nasprotnem primeru potrebno glede na stanje na tem področju obravnavati in dopolniti predlog zakona, ki ga kot v imenu predlagateljev zastopa poslanski kolega Drobnič. To materijo je potrebno vzeti odgovorno, ne glede na to, kdo je predlagatelj. Če se vlada ne strne v potrebi, da se zakon vloži v proceduro, je treba ravnati drugače. To je zaveza nas parlamentarcev. Še kaj bolj dorečenega bomo morali v takem primeru spregovoriti o predlogu zakona o humanitarnih in dobrodelnih organizacijah, ki nam tudi sledi. Hvala lepa.",Positive,M_Positive,"Although some questions, there is general support for ammendment, could be M_Positive.","First part positive (support), second negative ( topic + state of) and then positive in terms of support for the amandment.",,,False,,Positive,Positive
