,ID,text,tag_tamara,tag_katja,comments_tamara,comments_katja,flagged_tamara,flagged_katja,chair,final_tag,sent_tamara,sent_katja
45,ParlaMint-SI_2015-11-19-SDZ7-Redna-13.u172,"Hvala za besedo, predsednik. Lep pozdrav kolegicam in kolegom, državni sekretarki! Glejte, meni malo tlak dvignejo taki poskusi. Če povem malo za primerjavo, bi tudi pri samostojnem podjetniku morali plačati zaposleni, solidarno nositi izgubo, tako kot na kmetiji po vašem. Ali pa po drugi strani imamo primer nekih skupnosti, ki imajo stalna bivališča na centru za socialno delo, pa živijo v hišah, pa ne plačujejo nič, tudi kazni za prekrške se jim ne morejo zaračunavati od socialnih prejemkov, pa se vozijo z dragimi avtomobili in živijo v hišah na tujem zemljišču. A zdaj želite še kmete oziroma njihova gospodinjstva, njihove člane na nek način prisiliti, da se poslužujejo takih primerov, da bodo prijavljeni nekje drugje, za vsak slučaj, da slučajno davčna ne pride in kaj zaračuna? Eden bo v zidanici, eden bo na vikendu, eden bo pa doma, da se bo izognil temu. Mislim, da je ta poskus protiustaven. Nekdo, ki živi v neki hiši, v nekem gospodinjstvu, hodi v službo, dobiva plačo, drugi pa je, recimo, pravna oseba, ki se preživlja izključno s kmetovanjem. Zdaj ni več tako, kot je bilo včasih, vsi zjutraj na delo, vsi delajo na kmetiji in vsi vsi dobijo neke dobrine, ker so včasih delali samo za hrano. Zdaj je to drugače. Zdaj na teh večjih kmetijah s strojem skoraj eden naredi vse. Imajo robote za molžo. Tisti, ki je nosilec kmetije, je tudi lastnik vsega gospodarstva, ostali pa zelo malo pomagajo, razen pri kakšnih večjih opravilih, to je pa nekajkrat letno. In zdaj obremeniti slučajno nekega brata od tega nosilca gospodinjstva, ki živi v istem gospodinjstvu pa hodi v službo, ima čisto svoj denar ali pa koga drugega ali pa recimo starše bremeniti, pokojnino, ali kaj podobnega. Jaz mislim, da to ne gre. Res je, da pravite, da bo najprej izterjava nad kmetijskimi stroji, kmetijskimi zemljišči in še vsem ostalim, potem pa pride še to na vrsto. Jaz se bojim, da pri marsikakšnem kmetu tudi to ne bo dovolj, da bi poplačal vse kredite, ki jih je vzel, glede na situacijo, kakršna je v kmetijstvu. In verjetno tudi vi predvidevate takšne slučaje, zato boste sprejeli ta zakon, da boste res uničili kompletno družino, ne samo tistega, ki je nosilec kmetijskega gospodarstva. Meni se to zdi nepošteno, nepravično, pa mora biti tudi, toliko se ne spoznam, imate pa dosti pravnikov v poslanski skupini, pa bi morali vedeti, da je to po mojem mnenju tudi protiustavno. Mogoče bi bila ta solidarnost primerna pred petdesetimi, sto leti, ko so praktično vsi delali za hrano, da so se preživeli na tej kmetiji. Sedaj pa tega ni več. Razen, če hočete, družinske kmetije, ki so zelo potrebne, ki se bodo začele ukvarjati tudi z nekimi dopolnilnimi dejavnostmi, kjer pa bo potrebnih več rok. A boste zdaj vnaprej poskušali to razkopati, uničiti, da bi se v to smer tudi začeli razvijati? Jaz mislim, da to ni prav, nikakor ni prav, da takšno solidarnost prenašate tudi na celo gospodinjstvo. Ker potem bi morali tudi deooju preprečiti, da firmo pelje v stečaj, registrira drugo firmo in dela naprej, dolžniki pa se poplačajo samo z ustanovitvenim kapitalom 7 tisoč 500 evrov, vse ostalo pa upniki trpijo. Tam bi morali nekaj narediti, kjer se največ malverzacij naredi, ne pa razbijati zdaj še kmetije na takšen način oziroma vsaj ne strašite. Ker pravite, da bo malo takšnih primerov. Verjetno jih res ne bo veliko, ampak nekaj jih pa bo. S tem samo odvračate ljudi, da bi še delali na tej naši zemlji.",Negative,Negative,"Strong, negative words. ",,,,False,Negative,Negative,Negative
46,ParlaMint-SI_2009-06-15-SDZ5-Redna-07.u11,"Se samo strinjam s poslancem, da bo verjetno ta razprava zelo zahtevna. Tisto, kar je bistveno v mojem odgovoru, je, da torej Vlada pripravlja strokovne in druge študije, pripravlja tudi prvi osnutek za usklajevanje med poslanskimi skupinami v tem visokem zboru. Vemo, da je za to potrebna dvotretjinska večina. Slutimo lahko, da bi jo prej dosegli, če bi imeli veliko število pokrajin. Vemo pa, da veliko število pokrajin, zlasti ker, pravilno opozarjate na vprašanje pristojnosti in nalog, lahko pomeni ravno obratno od tistega, kar si Vlada oziroma vsaj sam želim pri tej diskusiji, da damo razvojni vidik v ospredje. Mislim, da takoj, ko damo razvojni vidik v ospredje, preveliko število pokrajin to potem delogira. Torej, mi vsi bomo soočeni, ta visoki dom bo na koncu odločil, kaj je pravi način, pravi kriterij ob prelaganju nalog in pristojnosti na pokrajine, zlasti finančni vidik, in sprejel neko odločitev. Vlada jo bo pripravila.",M_Positive,M_Positive,Hard,"Very confusing - I would say it is a bit neutral, but then again, it ould be mixed - it can have serveral different interpretations.",1.0,1.0,False,M_Positive,Positive,Positive
47,ParlaMint-SI_2014-12-05-SDZ7-Izredna-07.u32,"Jaz sem že enkrat razlagal tukaj, da če hočeš biti kuhar in delati v kuhinji, kjer je vroče, moraš vedeti, da moraš tudi prenesti vročino, ker drugače kuhar ne moreš biti in v vročini se ne da delati. Jaz še nisem videl kuharja, ki dela v ledeni kuhinji, to ne gre. Tako da se boste morali počasi navaditi. Ampak tisto, kar je bolj pomembno od tega, pa je, da ta argument, ki sem ga zdaj na koncu slišal, da gre po nujnem postopku zato, ker drugače se bo rok iztekel – predlagam vam, da tega ne ponavljate več. 90 dni je bilo dovolj časa. Ponavadi Vlada pride že v roku enega meseca takoj s tem zakonom ven in reši vse probleme. Tako da to ni najboljši odgovor, je pa zagotovo drugo vprašanje, ki pa je namenjeno ministru. Glejte, jaz sem prišel z argumenti ven, zakaj državni sekretarji, bodisi politični bodisi strokovni. Jaz verjamem, da minister za finance hoče imeti strokovnjake, ki mu bodo opravili levji delež na štirih različnih področjih. Ne nazadnje je naš strankarski kolega eden od tistih, ki bo k vam prišel za državnega sekretarja na MF, pa bom kljub temu rekel: boljše bi bilo, če bi ga pustili v kabinetu pri predsedniku, ker predsednik, veste, ima to varovalko, predsednik Vlade govorim, da ima lahko državnih sekretarjev zelo veliko, točno iz teh razlogov. Saj če boste pogledali, kateri državni sekretarji v vseh vladah, ne samo v tej, da se razumemo, so sedeli v kabinetu predsednika države, smo se včasih spraševali, kaj delajo tisti državni sekretarji v tisti vladi, v katerikoli vladi seveda. Tam je bilo kakšno takšno politično mesto. Je pa res, da je minister rekel, da bomo za to na Ministrstvu za finance dali tretjega državnega sekretarja. Kdo pa je četrti? Ali potem četrtega ne bo, ali kako? Zakaj pa imamo potem štiri državne sekretarje v zakonu? Jaz mislim, da bo, in to zelo jasno, ker minister ve, kaj hoče imeti. Vi morate še proračun pokriti, kajne. Predvsem pa je nekaj drugega: če hočete začeti delati drugače, tako kot pravite, morate to tudi argumentirati, in iz Zakona o državni upravi ni argumentacije, da bo nekaj drugače, ker je vse to, kar navajate v tem zakonu, že bilo. Jaz sem vam na odboru povedal zelo plastično in zelo natančno, da so vse te spremembe več ali manj že bile – že videno, sprakticirano in ugotovljeno, da je bilo slabo. To je ključen problem in to je ključen očitek z naše strani, da uvajate določene korake, ki niso v redu. Grem čisto konkretno na sam primer, na to, o čemer želim govoriti. Vi v zakonu govorite o tem, da boste uvedli pri informatiki določeno konsolidacijo informatike v procesu, in hočete preskočiti dva koraka in v treh letih narediti vse tisto, kar ste predlagali. Žal ne bo šlo. Vi sami veste, da lahko tisti, ki skače čez ovire in ne gre po vrsti in po fazah, na koncu naredi največ napak. Jaz do danes nisem slišal od ministra, da bo zamenjal glavne sesalce v državni upravi iz področja IT podjetij. Eni in isti, še enkrat, minister, ponavljam, eni in isti že 20 let sesajo to državo, in eni in isti delajo v vsaki vladi programsko shemo, kaj ima za delati in kaj ne. In še več, določa celo dinamiko, kdaj se bo kakšna stvar zgodila. In še več, trdim, da so celo ljudje eni in isti, tudi pri vas, minister, ki so že prej to delali in še pred tem to delali in tako naprej. Zato smo prišli z argumentom, zakaj je zelo dobro, če bi se vrnilo nazaj v situacijo, da gre v vladno službo, zato da bomo zmanjšali sistem korupcije, ker mislim, da predsedniku Vlade ministri ne bodo mogli več na ta način odvzeti tistih korakov oziroma bi se bistveno zmanjšali. Saj korupcije nikoli ne bomo izkoreninili. Tisti, ki to idealizira, je nor. Ampak zmanjšali bi jo pa zagotovo. Dokler se pa to svaljka po vrtičkih po posameznih ministrstvih, nismo naredili pa nič. Mi smo sedaj z enega ministrstva prestavili na drugo ministrstvo, ostalo bo pa vse isto, še ljudje so isti. Še enkrat, minister, zadnjič vas ni bilo na odboru, pa vam bom sedaj povedal: pokličite gospoda Viranta, bivšega ministra, in mu čestitajte, ker vam je zaposlil v ministrstvu cel svoj kabinet oziroma vse zaposlence. Kar je še bolj grozno, oživel vam je sistem, ki ga sam nikoli ni mogel sprovesti, ker smo ga vsi pravočasno zaustavili. Ideja je bila krasna, samo način, kako jo je zapeljal, je pa slab. Vi boste pa to nadaljevali in zato ne verjamem v ta projekt. Če kdo in če kaj vemo, je prav, da to tudi naglas povemo. Zaradi tega ne rabimo biti kritizirani, ker smo na nekaj opozorili. Minister, vse, kar boste danes povedali, vse, kar boste danes naredili – saj zakon bo sprejet, saj boste imeli možnost to speljati –, se vam bo kot kanon vrnilo čez dve leti, ko boste morali na tem istem mestu sedeti in razložiti, zakaj se ni zgodilo vse to, kar pravite, da se bo. Jaz bom počakal. Boste vi? Hvala lepa.",Negative,Negative,"Charged and demanding, also accusing.",,,,False,Negative,Negative,Negative
48,ParlaMint-SI_2014-04-02-SDZ6-Redna-23.u15,Hvala lepa tudi vam. Stališče Poslanske skupine Državljanske liste bo predstavila gospa Kristina Valenčič.,P_Neutral,P_Neutral,Procedural,,,,True,P_Neutral,Neutral,Neutral
49,ParlaMint-SI_2001-07-19-SDZ3-Redna-07.u14,Hvala lepa. Mnenje poslanske skupine Demokratične stranke upokojencev Slovenije bo predstavil gospod Anton Delak. Izvolite!,P_Neutral,P_Neutral,Procedural,,,,True,P_Neutral,Neutral,Neutral
50,ParlaMint-SI_2014-11-19-SDZ7-Redna-02.u143,Hvala lepa. Stališče Poslanske skupine Združene levice bo predstavil dr. Matej Vatovec.,P_Neutral,P_Neutral,Procedural,,,,True,P_Neutral,Neutral,Neutral
51,ParlaMint-SI_2004-05-06-SDZ3-Izredna-44.u298,"Hvala lepa. Tudi sam bom skrajšal svoj nastop. Hvala za besedo, gospa podpredsednica. Tudi meni ni prav, da ni naših kolegov z desne strani našega parlamenta, zato bo nastop krajši. Rad bi pa poudaril, da njihovi predlogi za interpelacijo in referendume, za odstope ministrov in sklicevanje izrednih sej, vse to se je dogajalo na račun državnega proračuna, milijoni tolarjev, ki so se na ta način razblinili in se razblinjajo v nič. Opozicija očitno ni zdržala, da bi počakala na čas uradne volilne kampanje za evropske in državnozborske, volitve temveč je predvolilno kampanjo sprožila že mesece prej. Danes je bil ogenj v strehi. Takoj, ko so opozicijske stranke SDS, Nova Slovenija in Slovenska nacionalna stranka ugotovile, da ni neposrednega prenosa na drugi mreži nacionalne televizije, so takoj sklicali novinarsko konferenco in se pred televizijskimi kamerami razjokale. Vse doslej jim je nacionalna televizija ustregla, tokrat očitno ne, saj mednarodne pogodbe o prenosu svetovnega hokejskega prvenstva imajo prednost. Pogodbe je namreč treba realizirati, obveznosti je treba izpolniti, pa čeprav na račun brezplačne predvolilne kampanje koalicije Slovenije. Opozicija si bo očitno morala izboljšati svojo programsko shemo, da bo postala zanimivejša od zimskih športov v spomladanskem času. Prav razveselil pa sem se tudi gradiva ministrstva za gospodarstvo, kjer je objavljen seznam prejemnikov državnih pomoči na javnih razpisih. Leta 2002 so za raziskovalno dejavnost dobila subvencijo 103 podjetja v Sloveniji. Le kako ste mogli predlagatelji današnje izredne seje državnega zbora med temi najti edino Ultro. Jasno, kajti Gregor Golobič je bil očitno prevelik magnet! Do leta 2004 je podobne subvencije v državi prejelo več sto podjetij, majhna, velika in srednja podjetja. Izmed njih ste stigmatizirali zgolj perspektivno mlado podjetje Ultra. Spomnim se prejšnjega mandata, ko smo v državnem zboru sprejeli tako imenovani zakon o tehnološkem tolarju, ki so mu peli slavo tako v koaliciji kot v opoziciji, danes pa problematizirate pomoč podjetjem za razvoj raziskovalne dejavnosti, spodbujanje internacionalizacije podjetij, spodbujanje izvoza malih in srednjih podjetij ter subvencij za spodbujanje tehnološkega razvoja. Ali pa sponzorske pogodbe, o katerih je bilo tudi že nekaj govora. Med stotinami sponzorskih pogodb ste našli komaj pet primerov. Le zakaj so si zaslužili vašo pozornost - zato, da ste lahko neupravičeno, posredno pokazali na Liberalno demokracijo in na Združeno listo. Insinuacija brez primere. Kaj pa je narobe s sponzorstvom ali z donatorstvom? Tako sponzorji, največkrat gospodarske družbe, kot sponzoriranci, različna društva, ustanove in posameznike iz področja športa, kulture in umetnosti sklenejo pogodbe z obojestranskimi, če lahko tako rečemo, koristmi. Vendar te pogodbe je treba realizirati in so zapisane črno na belem in so javni papirji. Zelo dobro bi bilo, če bi si predlagatelji prebrali posebno študijo z naslovom Ekonomika kulture in izvedeli, kaj več o sponzoriranju in da ne bi kriminalizirali ter povezovali s korupcijo. Treba je vedeti, da svetovni sponzorski fond v letu 2002 znaša kar zavidljivih 24 milijard dolarjev, od tega skoraj 10 milijard dolarjev Združenih državah Amerike in 7,1 milijarda v Evropi. Tako je v ZDA na primer najbolj privlačna sponzorska naložba šport, ki z 67% daleč prekaša vsa ostala področja. Tudi v Sloveniji je nekaj podobnega. Najbolj zanimivo sponzorsko področje je šport in ravno te primere ste apostrofirali predlagatelji današnje izredne seje. Daleč zadaj sta kultura in umetnost, da ne govorim o dobrodelnih prireditvah ter znanosti in izobraževanju. Kdo pa bo sploh še hotel sponzorirati, če se bo znašel na vaših črnih spiskih? Se ne zavedate, da boste s tem početjem še zmanjšali tako ali tako majhna sponzorska sredstva za šport, kulturo, umetnost in druga področja? Hvala lepa in se opravičuje sicer za malo daljši nastop, sem ga pa vseeno skrajšal.",Negative,Negative,Clearly negative. ,Sarcastic.,,,False,Negative,Negative,Negative
52,ParlaMint-SI_2016-01-25-SDZ7-Redna-15.u166,"Hvala, predsedujoča. Hvala za dano besedo. Dr. Mramorju, ministru za finance, bi rad postavil vprašanje v zvezi z nakupom delnic Pozavarovalnice Sava s strani Republike Slovenije. Glede na njegovo odsotnost bi pričakoval pisni odgovor. Pred časom se je Republika Slovenija odločila, da kupi malo več kot 3 % delnic Pozavarovalnice Sava od NKBM in od Pošte Republike Slovenije, za kar je odštela malo več kot 6,3 milijona evrov. Takšne informacije smo lahko zasledili v medijih in tudi iz sporočila Ministrstva za finance. Ministra za finance seveda sprašujem: Kateri so razlogi za to? Dejstvo je, da strategija o upravljanju državnega premoženja ne predvideva povečevanje deleža ali s strani Slovenskega državnega holdinga ali s strani Republike Slovenije v naložbi Pozavarovalnica Sava, d. d. Dejstvo je, da ima SDH v lastništvu 25 % plus eno delnico te naložbe. Ali je s takšnim nakupom teh delnic soglašal tudi SDH oziroma kakšno je stališče uprave in Nadzornega sveta Slovenskega državnega holdinga glede na dejstvo, da Slovenski državni holding tudi upravlja s to naložbo? Kaj bo povečanje tega deleža prineslo Republiki Sloveniji? Kje je tista dodana vrednost, zaradi česar se je Republika Slovenija odločila za takšen nakup? Ali so pri tem nakupu bili še kakšni drugi stroški za Republiko Slovenijo? Predvsem pa sem osebnega mnenja, da takšen nakup ni bil v danem trenutku potreben glede na lastniško strukturo in na razporejene deleže, predvsem pa na dejstva in na stanje javnih financ, da bi teh 6,3 milijone evrov lahko država namenila tudi za druga, bolj pomembna področja, kot je šolstvo, kot je sociala, kot je zdravstvo. Še enkrat, pričakujem odgovor ministra za finance.",Negative,Negative,"Questioning, but also expresses his non support. ",Charged questions  and negative,,,False,Negative,Negative,Negative
53,ParlaMint-SI_2002-12-19-SDZ3-Izredna-25.u243,"Hvala za besedo. Spoštovane poslanke in spoštovani gospodje poslanci! Seveda je to podoben primer, kot je bil že tudi pri enem amandmaju prej.Predvideno je jemanje s postavk na javni gozdarski službi, kjer imamo povečane potrebe in je tudi že manjko sredstev, zato so tudi že drugi predlogi za povečanje teh postavk. Torej se ne moremo strinjati z zmanjševanjem na tem, kajti to pomeni krnitev obsega služb, ki so določene z zakonom in tudi ne moremo posegati v organizacijo oziroma tudi v stroškovnik služb. Zato se s tem ne moremo strinjati.",Negative,Negative,Non support. ,,,,False,Negative,Negative,Negative
54,ParlaMint-SI_2007-10-23-SDZ4-Redna-32.u76,"Hvala lepa za besedo. Samo dva stavka sem hotela. Kolega Germič je rekel, da smo postavili edini recept in edino zavezo v zvezi s humanitarnimi in invalidskimi organizacijami in določili odstotke. Temu nasprotujem, ker smo že v tem mandatu spreminjali odstotke sredstev, ki se delijo med humanitarne in invalidske organizacije. Prej sem že povedala, pa mogoče nisem imela dovolj časa, od ustanovitve fundacije in od takrat, ko smo prvič določili razmerje, kako se bodo sredstva delila, so se, če govorim samo o sredstvih, spreminjala z 90:10, 75:25, in v tem mandatu smo spreminjali sredstva, torej razdelitev po odstotkih med humanitarne in invalidske na 65:35. In najbrž stvar ni zabetonirana, najbrž bomo še kdaj kaj spreminjali. Ob tem je treba povedati, da so invalidske organizacije, v začetku sta bili dve, danes je 17 reprezentativnih ali 18, medtem ko je bilo humanitarnih na začetku 3, zato so bile tudi vključene v svet fundacije, Karitas, Rdeči križ in podobno, do danes, ko jih je 52. Ob tem je treba vedeti, da ustanoviti invalidsko organizacijo je verjetno drugače kot ustanoviti humanitarno organizacijo. Zato tudi bistveno ne narašča število invalidskih organizacij, ki so bile v teh dobrih desetih letih ustanovljene, za razliko od humanitarnih. Jaz ne pravim, da to ni potrebno, da ne potrebujemo humanitarnih organizacij, ampak v duhu pravičnosti je pa že treba to pogledati z večjih vidikov. Morda še nekaj o tem, ali naj Olimpijski komite odloča na skupščini. Če bomo danes pogledali sestavo sveta, kateri vsi športi niso vključeni oziroma katerih predstavnikov ni - s strani olimpijskega komiteja je predlagan, predsednik balinarske zveze Slovenije. To je super, balinarje podpiramo - nobeden problem, ampak da zraven ni prostora za košarkarje, nogometaše, rokometaše, hokej, odbojko, gimnastiko, veslače in tiste, ki Sloveniji prinašajo medalje, pa verjetno ni čisto prav. In ob tem se je treba vprašati tudi o teh vprašanjih. Hvala lepa.",Negative,Negative,Questioning that aludes to negative opinion. ,"While the sentiment is maybe not as strong as with other, the overall tone seems to be negative.",,,False,Negative,Negative,Negative
55,ParlaMint-SI_2006-11-23-SDZ4-Redna-22.u260,"Hvala lepa, gospod dr. Verlič. Ker so bili v drugi obravnavi sprejeti amandmaji k manj kot desetini členov dopolnjenega predloga zakona, predlagatelj zakona predlaga, da zbor na podlagi prvega odstavka 138. člena Poslovnika še na tej seji opravi tretjo obravnavo predloga zakona. Prehajamo na odločanje o navedenem predlogu. Sklep ne bo sprejet, če mu bo nasprotovala več kot tretjina navzočih poslancev. Glasujemo. Navzočih je 64 poslank in poslancev, za je glasovalo 58, proti 6. (Za je glasovalo 58.)(Proti 6.) Ugotavljam, da je predlagani sklep sprejet. Državni zbor bo tretjo obravnavo predloga zakona opravil v torek, 28. novembra 2006, v okviru glasovanj. Službe zbora bodo pripravile pregled v katerem bo vključen sprejeti amandma in člen h kateremu je bil amandma sprejet. Amandmaje k temu členu lahko kvalificirani predlagatelji vložijo do začetka tretje obravnave predloga zakona na seji zbora. Prekinjam to točko dnevnega reda. Nadaljujemo s prekinjeno 14. točko dnevnega reda - obravnava Predloga zakona o spremembah in dopolnitvah zakona o varnosti cestnega prometa po skrajšanjem postopku. Prehajamo na odločanje o naslednjem predlogu sklepa: Predlog zakona o spremembah in dopolnitvah zakona o varnosti cestnega prometa ni primeren za nadaljnjo obravnavo. Glasujemo. Navzočih je 66 poslank in poslancev, za je glasovalo 65, proti 1. (Za je glasovalo 65.)(Proti 1.) Ugotavljam, da je zbor sklep sprejel, zato je zakonodajni postopek o predlogu zakona končan. S tem zaključujem to točko dnevnega reda. Nadaljujemo s prekinjeno 15. točko dnevnega reda - obravnava Predloga zakona o spremembah in dopolnitvah zakona o delovnem času in obveznih počitkih mobilnih delavcev ter o zapisovalni opremi v cestnih prevozih, skrajšani postopek. Prehajamo na tretjo obravnavo predloga zakona v okviru skrajšanega postopka. Ker v tretji obravnavi ni možno vlagati amandmajev, prehajamo na odločanje o zakonu. Glasujemo. Navzočih je 67 poslank in poslancev, za je glasovalo 66, proti nihče. [[Za je glasovalo 66.]] [[Proti nihče.]] Ugotavljam, da je zakon sprejet. S tem zaključujem to točko dnevnega reda. Prehajamo na 4. točko dnevnega reda. Zbor bo v skladu s 139. členom Poslovnika zbora glasovanje o Predlogu zakona o dopolnitvi zakona o zagotavljanju socialne varnosti slovenskim državljanom, ki so upravičeni do pokojnin iz republik nekdanje SFRJ, opravil v torek, 28. novembra 2006, v okviru glasovanj. Nadaljujemo s prekinjeno 18. točko dnevnega reda - obravnava Predloga zakona o spremembah in dopolnitvah zakona o odpravljanju posledic dela z azbestom, skrajšani postopek. Nadaljujemo z drugo obravnavo, to je z odločanjem o vloženih amandmajih. Prehajamo na odločanje o amandmaju poslanskih skupin LDS in SD k 1. členu. Glasujemo. [[Oglašanje iz dvorane.]] Prekinjam glasovanje. Odpiram postopek prijav za obrazložitev glasu v imenu poslanske skupine. Gospod Ljubo Germič, v imenu poslanske skupine LDS, izvolite.",P_Neutral,P_Neutral,Procedural,,,,True,P_Neutral,Neutral,Neutral
