,ID,text,tag_tamara,tag_katja,comments_tamara,comments_katja,flagged_tamara,flagged_katja,chair,final_tag,sent_tamara,sent_katja
137,ParlaMint-SI_2010-02-11-SDZ5-Izredna-19.u125,"Gospod podpredsednik, hvala lepa za besedo. Lep pozdrav velja ministru s sodelavcem. Kolegice in kolegi. Več kot pravično je, da vsak, ki dela, mora zaslužiti za bolj dostojno in kvalitetno življenje. Ampak, kaj pomeni dostojno živeti? Je mogoče živeti dostojno, če tvoj že tako težko prislužen dohodek pod pragom revščine? Je dostojno to, da si ne moreš privoščiti niti košarice minimalnih življenjskih potrebščin? Višina minimalne plače je danes v Sloveniji takšna, da se njeni prejemniki uvrščajo med socialne kategorije, kar pa ni v duhu nobenega od plačil v poplavi množice socialnih listin in mednarodnih pogodb, katerih podpisnica je tudi naša država. Med dvajseterico evropskih držav, ki imajo zakonsko urejeno minimalno plačo, se Slovenija po njeni višini danes uvršča sicer v zlato sredino, a je še vedno v krepkem zaostanku za tistimi državami, kjer je znesek minimalnega dohodka nad 1.000 evrov. Minimalna plača je točka, okoli katere se vedno, še za posebej v neugodnih gospodarskih razmerah odvija glavni konflikt v vsaki družbi. Vsaka stran vleče vrv v svojo smer in boj za minimalno plačo se danes, žal, povsod deklarira kot politični boj. Vlada se je v zvezi s problematiko reševanja vprašanja minimalnih dohodkov iz naslova dela, po naši oceni, odločila v pravi smeri. Ureditev instituta minimalne plače je enakovredno in navkljub še vedno obstoječemu kritičnemu stanju v gospodarstvu prilagodila pričakovanjem tako delavcev kot tudi delodajalcev. Delavci, ki so prejemniki zakonsko najnižjih plač, bodo tako na podlagi tega predloga z določitvijo nove višine minimalne plače mesečno zaslužili okoli 100 evrov več kot doslej in bodo tako dosegli tudi zmanjšanost plačila košarice. Da bi se delodajalci ob tem povišanju izognili hujšim težavam, ki bi ne nazadnje lahko pomenile tudi nelikvidnost in množično odpuščanje, je vključitev možnosti postopnega prehoda na novo določeno višino minimalne plače ustrezna rešitev, ki bo prepričala ali vsaj omilila večanje števila brezposelnih. Tako so vsa vnaprejšnja ugibanja o tem, kolikšno odpuščanj delavcev bo prineslo zvišanje stroškov dela, odveč. Tudi zaradi tega, ker bo država velik del bremena v korist delodajalcev prevzela nase v obliki spreminjanja dohodninske ureditve. Zakon predvideva tudi drugačno rešitev usklajevanja minimalne plače, ki je po našem prepričanju boljša. Uveljavljanje rasti minimalne plače bo pogojeno na realni rasti cen življenjskih potrebščin. Ta primarni način usklajevanja z dejansko rastjo cen pa bo mogoče popraviti oziroma nadgraditi v primeru, če bi drugi podatki kazali takšna gibanja, da samo neposredna ureditev z rastjo cen ne bi bila primerna. Tako se lahko po posvetu s socialnimi partnerji upoštevajo tudi drugi dejavniki - gibanje plač, gospodarska rast, gibanje nezaposlenosti. Finančne posledice tega zakona za državni proračun so upoštevaje vseh transferjev in nadomestil, ki so vezani z minimalno plačo in povečanje plač tistih javnih uslužbencev, ki prejemajo minimalno plačo, ocenjene letos na približno 19 milijonov evrov. Druge posledice, ki jih bo prinesel ta zakon, pa bodo verjetno tudi pritisk za povečanje plač dveh skupin zaposlenih. Tistih zaposlenih, ki imajo višjo plačo, kot je zdaj minimalna, vendar nižjo, kot je predlagana, in tisti, ki prejemajo plačo, ki je nekaj višja od predlagane minimalne plače. Torej, koncentracija prejemkov nizkih plač okoli minimalne plače je že zdaj razmeroma visoka, se bo po uveljavitvi zakona še povečana. Vendar naj ob tem opozorim na dejstvo, da je zaradi davčnega in prispevnega izogibanja delodajalcev realno število tako prejemnikov minimalne plače in plače nekoliko višja od minimalne bistveno manjše, kot kažejo uradni podatki. Zaradi tega po naši oceni ni odveč, da ob tej priložnosti, ko govorimo o problematiki najnižjih dohodkov, apeliramo na pristojne, da se aktivno in striktno pristopi k reševanju te problematike. V Poslanski skupini DeSUS bomo predlagani zakon podprli.",Positive,M_Positive,Support. ,"Starts faily negative (topic), with fairly negative accusations, and then speaker presents reasons for support and the positive effects they expect from the proposed bill. ",,,False,,Positive,Positive
138,ParlaMint-SI_2002-02-12-SDZ3-Izredna-14.u102,"Hvala lepa. Gospe Majnikovi se zahvaljujem za kompliment, da se kemiki spoznamo na več stvari. To je verjetno res, smo pač po naravi tak profil, ki ima relativno širok spekter izobrazbe, znanja, kajti tudi Margaret Thatcher je bila zelo uspešna v politiki, pa je bila tudi kemik, seveda moramo to povedati. Hkrati pa mi je gospa Majnikova hotela s svojo repliko onemogočiti, da se oglašam pri različnih zadevah, in v bistvu tega ne razumem. Če sem prej tudi na nek način diskutiral, da je njen pogled ozek na to temo, s tem nisem rekel, da ji prepovedujem debato, absolutnone. Ona pa bi meni rada sedaj na nek način prepovedovala debato, proti čemur protestiram, kajti morali bi se zavzemati za to, da bi se različni profili v tej hiši zanimali za različne stvari. To bi bilo pravilno stališče, ne pa tako, kot skušate zavreti sleherno debato. Hvala lepa.",Negative,M_Negative,Strong negative words. ,If first part is read as sarcastic it could also ne Negative.,,1.0,False,,Negative,Negative
139,ParlaMint-SI_2010-09-23-SDZ5-Redna-20.u222,"Hvala lepa, gospod podpredsednik. ""Ker Slovenija še danes nima športne dvorane in stadiona,"" berem gradivo oziroma odgovor ministra Lukšiča, da bi se vrnili na izvirno zgodbo in bi vse skupaj razumeli, za kaj pravzaprav gre, ""ki bi ustrezala visokim evropskim standardom za organizacijo velikih mednarodnih športnih prireditev, je bil projekt izgradnje takšnega športnoprireditvenega centra umeščen v resolucijo nacionalnih razvojnih projektov za obdobje 2007–2023 že v mandatu prejšnje vlade. Ravno zaradi tega so med Mestno občino Ljubljana in Vlado Republike Slovenije pred letom 2008 potekali razgovori za zagotovitev 40 milijonov evrov iz državnega proračuna. Za projekt izgradnje dvorane in stadiona v centru Stožice je bilo leta 2008 v državnem proračunu že zagotovljenih 10 milijonov evrov. Sredstva žal niso bila realizirana za projekt izgradnje dvorane in stadiona v centru Stožice, saj ni bilo ustrezne pravne osnove, ne dokumentov za črpanje sredstev"". Zgodba nadaljuje, da je ""za izgradnjo dvorane in stadiona v Celju država iz državnega in evropskega proračuna do letos vložila dva milijona 344 in nekaj evrov, za izgradnjo stadiona v Mariboru pa 4 tisoč 73 evra. Noben od dveh stadionov ne zagotavlja tako visoko evropskih standardov, garderobe, VIP prostori in prostori za medije, varnosti in storitve za obiskovalce, za nastop reprezentance, za organizacijo športnih, velikih mednarodnih športnih prireditev, kot jih bo stadion v Stožicah. Mestna občina Ljubljana je leta 2008 s projektom Stožice kandidirala na razpis za črpanje evropskih sredstev. Ker imajo zaradi politik o uravnoteženem razvoju Slovenije prednost pri sofinanciranju projekti iz manj razvitih občin, projekt Stožice ni bil sofinanciran"" in tako dalje. Vse je lepo pojasnjeno v odgovoru ministra. In zgodba je zelo jasna in transparentna, kajti to so dokumenti. To niso predvolilni blefi. In ko to prebereš in ugotoviš, za kaj gre, bi lahko tako interpelacijo zaključili, recimo, v eni uri. Poleg tega minister zelo dobro vodi svoj resor. Jaz mislim, da celo odlično. [[oglašanje iz dvorane]] Hvala, da ste ugotovili, da je naš. Jaz bi se ob tej priložnosti ministru zahvalil tudi za vse tisto, kar je naredil drugod po Sloveniji, ko nekateri govorite samo Stožice in konec zgodbe. Ni res. Marsikaj je bilo zelo dobro narejeno, tako kot so nekateri kolegi povedali. Pa tudi vi bi to priznali, če danes ne bi govorili o interpelaciji, pa tega ne smete, ker bi vas kregal vaš veliki šef. Jaz osebno se mu zahvaljujem, da smo tudi v Kopru ob vsem tem dobili nov srednješolski tehnični center, ki je zelo velik, zelo razvejan. Vrednost tega objekta je 15 milijonov evrov. In tako smo vložili tudi v šolo, ki bo zagotavljala orodjarje, tehnične kadre in vse druge profile, ki jih v tej državi nujno potrebujemo. Jaz bi vam samo še rad povedal zgodbo o tezi, da je ta interpelacija zloraba slovenskega parlamentarizma za predvolilne namene največje opozicijske stranke. Ne glede na to, da v tem filmu naslovno vlogo tudi igrate, je minister le stranski igralec. Ko onemogočijo razpravo o bulmastifih, sledi interpelacija ministra za kmetijstvo. Ko onemogočijo razpravo o domnevnih kreditih župana in sploh o njem, interpelirajo ministra za šolstvo in šport in tako naprej. In še nekaj, gospod podpredsednik, ker ste dovolili gospodu Jerovšku govoriti o volilni kampanji, boste tudi meni pol minute. Gospoda Jankovića ste zabrisali skozi okno, pa je prišel skozi velika vrata nazaj noter. Danes ste mu naredili tako veliko uslugo, da jaz ne vem, kaj vam je dal, ampak res ste mu naredili velikansko reklamo. Hvala lepa.",M_Negative,Negative,"Some positive about the minister, but the end is very negative.",Everything that was not read from a report is direct and (at points) sarcastic attack.,,,False,,Negative,Negative
140,ParlaMint-SI_2017-11-22-SDZ7-Redna-35.u171,"Besedo ima gospa Anja Bah Žibert, pripravita naj se gospod Branko Zorman in mag. Andrej Šircelj.",P_Neutral,P_Neutral,Procedural,,,,True,P_Neutral,Neutral,Neutral
141,ParlaMint-SI_2009-12-15-SDZ5-Redna-12.u257,"Hvala za besedo. Ko govorimo o 10%, govorimo seveda o izjemi. Iz nekaterih izjav gre sklepati, da govorimo o poklicnih diplomatih, o vseh tistih drugih, ki pa niso poklicni diplomati, pa seveda predpostavljamo, da morajo biti nujno politiki. Ne! Gre za to, da je vsak sistem, ki ostaja zaprt, slej kot prej tudi zatohel. Ta vlada je začela z ambiciozno politiko na zunanjepolitičnem področju, na novo je ovrednotila naše zunanjepolitične prioritete, predvsem na področju zahodnega Balkana, kjer imamo številne, tudi svoje gospodarske interese. Ker so nekateri v razpravah prej omenjali gospoda Borisa, jaz sem imel v življenju privilegij, da sem se lahko politike učil od tega človeka. In danes, ko je veleposlanik naše države v Izraelu, lahko rečem, da prejšnji vladi lahko predstavlja ponosno imenovanje, ker velja neuradno za drugega najpomembnejšega veleposlanika v Izraelu, takoj za veleposlanikom Združenih držav. Ne zato, ker prihaja iz vplivne države, ampak zato, ker je s svojim delom, s svojim ugledom in s svojo angažiranostjo zgradil en ugled. In takšne veleposlanike potrebuje ta država, če želi uresničiti svoje zunanjepolitične prioritete.",Positive,M_Positive,Support and nice words about a person. ,"Starts with defense and negative conntations, then picks up with an example and positive sentiment towards the subject as a great example. ",,,False,,Positive,Positive
142,ParlaMint-SI_2012-11-06-SDZ6-Izredna-19.u178,"Seveda bom glasoval za, saj je argumentacija, ki je v predlogu za presojo, vsekakor upravičena. Naj pa k tej argumentaciji dodam še en ustavnopravni argument, o katerem danes še nismo govorili. Pokojni dr. Jože Pučnik, dejanski oče samostojne Slovenije, je dosegel, da se je, ko se je oblikovalo slovensko Ustavo, v 67. člen zapisalo, da mora zakon določati uresničevanje lastnine tako, da je zagotovljena tudi njena gospodarska, ekološka in socialna funkcija. Koliko je ta člen spoštovan pri sedanji ureditvi – že, ko gre za vprašanje polnega uresničevanja njene gospodarske funkcije –, je seveda veliko vprašanje. Ampak, ko pa gre za vprašanje njene socialne funkcije ob zgolj simboličnih vsotah ali celo izgubi, ki prihaja iz orjaškega denarja, ki je investiran v tisto lastnino, ki je zajeta v podjetjih, v katerih je javna lastnina, pa je najbrž očitno, da bi tovrstna razprava spominjala na tisto debato, ali je mogoče s tal sploh še kam pasti. Zagotovo je novi zakon, katerega cilj je, da bi bila ta lastnina bistveno bolje izkoriščena, bistveno bolj produktivna – in s tem bi bila polno omogočena tudi njena socialna funkcija, to se pravi, da bi prilivi iz tega krepili zdravstvo, šolstvo, socialno varnost ljudi, splošno blaginjo ljudi –, v polni meri uresničevanja ustavne določbe, o kateri sem govoril. Sedanja ureditev pa je iz tega vidika neprimerna in očitno neustrezna.",M_Positive,M_Negative,"Support, but expresses some negatives. ","Support to fix current state, where the speaker expresses a very negative opinion of it. However there are some glimpses in the positive at certain points, so it  is not purely negative. ",,1.0,False,,Positive,Negative
143,ParlaMint-SI_2015-07-17-SDZ7-Izredna-16.u82,"Hvala, podpredsednica. Spoštovane predstavnice ministrstev, spoštovani kolegi in kolegice! Vsi tu se strinjamo, da je to korak v pravo smer, da širimo cenzus, da bo več otrok upravičenih do brezplačnega kosila. Seveda vidimo različne poti. Sama mislim, da je prav, da otroci ne delijo usode svojih družin, če so materialno šibke, in da jim vsaj na tem najbolj osnovnem področju blažimo posledice, da se na ta način lahko psihofizično v šoli bolje počutijo in bolje delujejo. Veliko je bilo tu govora o tem, kaj bi bili temeljni ukrepi, da bi to preprečili, gospodarska rast, več delovnih mest, ukrepi, ki bi nekje v temeljih poskrbeli, da bi bilo čim manj takšnih primerov. Veliko je bilo tudi govora o tem, da je to gasilska akcija, da je to ozko gledanje in da bi potrebovali širši nabor ukrepov. S tem se lahko deloma strinjam, kajti to, da smo mi izpostavili tu samo prehrano, je res v bistvu osvetljevanje samo enega dela tega, da država vendarle že sedaj s širokim naborom socialnih ukrepov pomaga družinam in otrokom. Poleg te prehrane imajo družine, tudi tiste, ki so pod pragom revščine, že danes na razpolago otroške dodatke, denarne socialne pomoči, izredne denarne socialne pomoči, štipendije, oprostitev plačil vrtca, dodatek za nego, dodatek za veliko družino, pomoč ob rojstvu otroka, starševske dodatke in starševska nadomestila, takšna, kot jih pravzaprav nikjer v Evropi nimajo. Lahko torej ugotavljamo, da imamo že danes zelo širok nabor ukrepov, ki seveda to, da je nekdo pod pragom revščine, že danes izboljšuje. Lahko govorimo, da tisti, ki so v prvem, drugem in tretjem dohodkovnem razredu otroškega dodatka, z vsemi temi socialnimi pomočmi, ki sem jih naštela, verjetno niso več pod pragom revščine, in da to, o čemer danes govorimo, v bistvu namerno zožujemo in ne vidimo celega problema. Jaz nekako razumem, da je Vlada sledila tudi temu dejstvu, da si ni pustila popačiti slike in da je upoštevala tudi različne dohodke, ki jih ima neka družina. To je na nek način socialno pravično, saj verjetno je prav, da tista družina, ki zasluži dvakrat več, dobi nekega transferja manj kot tista družina, ki zasluži dvakrat ali trikrat manj. Kajti če bi ne glede na dohodke družini kar dajali 100 % oprostitve plačila vrtca, 100 % subvencije prevozov, prehrane, 100 % štipendije, potem bi bila marsikatera od teh družin na boljšem kot tisti delavci, ki delajo in živijo svoje družine z minimalno plačo ali pa celo plačo, ki je večja od minimalne. Mislim, da je treba upoštevati tudi to dejstvo in tudi ta cilj, ki je eden izmed osnovnih ciljev vseh socialnih transferjev in socialne zakonodaje, da nekdo, ki ne dela, ne more biti v boljšem položaju kot tisti, ki dela. Kar se pa po drugi strani tiče datuma uveljavitve, je takole, da imamo v celi Sloveniji okrog 450 osnovnih šol, 800 je približno podružničnih šol. 85 šol se je podpisalo pod to, da bi ta ukrep začel veljati takoj. Jaz verjamem, da so si šole glede na zmožnosti, kadrovske in tehnične, pa vsi vemo, da je javni sektor ravno v teh zmožnostih zelo omejen, vendarle v zelo zelo različnem položaju in da ne morejo vse takoj obrniti plošče ter se v času počitnic pripraviti na 14 tisoč več obrokov, kolikor jih ta predlog zakona prinaša. Po drugi strani se mi pa zdi tudi nekako nedosledno od predlagatelja, ki se zavzema za pravice delavcev – in prav je tako –, da ne upošteva, da so tudi šolniki delavci in da lahko svoj dopust vzamejo samo med šolskimi počitnicami. Hvala.",M_Negative,M_Positive,,"Mixed sentiment - the speaker expresses positive support for proposed changes, but then expresses some views where this changes might not be very positive.  But the overall tone feels positive, even if a bit weak...",1.0,1.0,False,,Negative,Positive
144,ParlaMint-SI_2007-03-07-SDZ4-Redna-25.u63,Hvala. In k besedi vabim poslanca Martina Mikoliča.,P_Neutral,P_Neutral,Procedural,,,,True,P_Neutral,Neutral,Neutral
145,ParlaMint-SI_2009-06-16-SDZ5-Redna-07.u278,"Hvala lepa. Obrazložitev glasu, ponovno prosim za prijave. Besedo ima Milenko Ziherl. Prosim.",P_Neutral,P_Neutral,Procedural,,,,True,P_Neutral,Neutral,Neutral
146,ParlaMint-SI_2010-07-12-SDZ5-Redna-19.u77,Želi še kdo razpravljati? Gospod Marijan Križman.,P_Neutral,P_Neutral,Procedural,,,,True,P_Neutral,Neutral,Neutral
147,ParlaMint-SI_2002-05-29-SDZ3-Redna-16.u180,"Hvala lepa. Gospod Vnučec, izvolite.",P_Neutral,P_Neutral,Procedural,,,,True,P_Neutral,Neutral,Neutral
148,ParlaMint-SI_2014-05-14-SDZ6-Izredna-64.u19,Hvala tudi vam. Gospod Aljoša Jerič bo predstavil stališče Poslanske skupine nepovezanih poslancev.,P_Neutral,P_Neutral,Procedural,,,,True,P_Neutral,Neutral,Neutral
149,ParlaMint-SI_2003-12-16-SDZ3-Redna-32.u269,"Hvala lepa. Gospod Tanko, izvolite.",P_Neutral,P_Neutral,Procedural,,,,True,P_Neutral,Neutral,Neutral
150,ParlaMint-SI_2012-05-11-SDZ6-Izredna-13.u53,Mag. Andrej Šircelj.,P_Neutral,P_Neutral,Procedural,,,,True,P_Neutral,Neutral,Neutral
151,ParlaMint-SI_2001-01-26-SDZ3-Redna-02.u59,"Hvala za besedo, gospod podpredsednik. Spoštovani zbor! Umaknil bom amandma k 9.a členu in - da ne bo pomote - k 21. členu, ker bosta oba člena osnovnega zakona, ki je bil sprejet leta 1995 - oziroma sta že na presoji pri ustavnem sodišču in sem skoraj zagotovo prepričan, da bo prišlo do spremembe teh dveh členov oziroma da bodo tisti, ki jim nasprotujejo, doživeli spremembo na ustavnem sodišču. No, pri amandmaju k 20. členu bom pa vztrajal.",M_Negative,Negative,This one is very very hard. Could be anything.,"Confusing speech - not sure if there is a threat in the middle of the speech,or if  (due to confusing structure) there might be nothing.",1.0,1.0,False,,Negative,Negative
152,ParlaMint-SI_2002-11-28-SDZ3-Redna-20.u146,"Hvala lepa, gospod podpredsednik. 62.000 podpisov državljank in državljanov je številka, nad katero se pravzaprav mora zamisliti tisti, ki je predlagal zakon in ki seveda nima podpore med temi prebivalci. 62.000 podpisov je tista številka, katere ljudi skrbi, kaj se bo zgodilo s Slovenskimi železnicami. Ne samo formalna skrb za to, ampak dejanska skrb tudi po izgubi svojih delovnih mest. Ti državljani in državljanke Republike Slovenije so bili prevečkrat ""naplahtani"". Bil je zakon, ki je govoril o ohranjanju delovnih mest v Tamu v Mariboru. Danes je to že davno zgodovina. Sredstva iz državnega proračuna so bila porabljena. Temu se reče oškodovanje družbenega premoženja. S takšnim zakonom, kot ga je vlada predlagala, bi ponovno naredili isto zakonsko podlago za oškodovanje družbenega premoženja. Temu se je seveda potrebno upreti. Tudi če je kakšna beseda ali stavek nekaterim nerazumljiva, bodo pač pravniki to razložili. Zato imamo tudi institute in institucije, kot je ustavno sodišče in tako dalje. Ampak odločitev poslancev državnega zbora v skladu z ustavo in zakonom je, če so izpolnjeni pogoji, da državni zbor razpiše ta referendum. Naloga tega državnega zbora je pač tisto, kar je postopkovno, to pomeni določiti roke. Tisti, ki bodo glasovali proti temu razpisu, glasujejo proti slovenskemu narodu, glasujejo proti ustavi in zakonu. Jaz bom podprl razpis referenduma.",M_Positive,Negative,"Supports, but expresses some negatives.",,,,False,,Positive,Negative
153,ParlaMint-SI_2014-11-21-SDZ7-Redna-02.u3,Hvala. Poročilo je obravnavala Komisija za peticije ter za človekove pravice in enake možnosti kot matično delovno telo in pripravila predlog priporočila Državnega zbora. Besedo dajem predsednici gospe Evi Irgl za predstavitev poročila komisije.,P_Neutral,P_Neutral,Procedural,,,,True,P_Neutral,Neutral,Neutral
154,ParlaMint-SI_2006-11-16-SDZ4-Izredna-23.u45,Hvala. Besedo ima gospod Kovačič.,P_Neutral,P_Neutral,Procedural,,,,True,P_Neutral,Neutral,Neutral
155,ParlaMint-SI_2015-12-15-SDZ7-Redna-14.u109,"Sledi predstavitev stališč poslanskih skupin. Besedo ima Poslanska skupina Socialnih demokratov, zanjo mag. Bojana Muršič.",P_Neutral,P_Neutral,Procedural,,,,True,P_Neutral,Neutral,Neutral
156,ParlaMint-SI_2006-05-25-SDZ4-Redna-17.u106,"Hvala za besedo. Sam osebno ne morem podpreti amandmaja k 9. členu pod točko ena, niti ne pod točko dva. Mislim da je prav, kot je poslanski kolega Ljubeljšek povedal, da je dikcija dobro zapisana, ""kdor berači na vsiljiv ali žaljiv način"", in da je predpisana minimalna kazen 10 tisoč tolarjev. To pa pomeni 10 tisoč tolarjev, če ne plačaš kazni, če se ne motim, po zakonu o prekrških je to 1 dan zapora. To je tista minimalna sankcija. Konec koncev veliko ste danes tukaj povedali glede beračev in klošarjev. Razlika med berači in klošarji je naslednja. Klošar je tisti, ki nima sredstev, stalnih sredstev ali vira za preživljanje in stalnega bivališča. Berač je pa tisti, ki ima stalno bivališče, nima pa sredstev za preživljanje, in na ta način pač berači. In po svoje gre samo za status stalnega bivališča, več ali manj pa se v realnem življenju in vsakodnevnem lahko srečamo na eni strani z beračem ali klošarjem. Kdo postane klošar ali berač, spoštovani poslanski kolegi? Nihče si v tem danem svetu ne izbere takšnega načina življenja. V takšen način življenja, življenje klošarja ali berača, je pahnjen s strani družbe bodisi zaradi osebnega razočaranja, bodisi zaradi tega, ker je izgubil službo, bodisi zaradi drugih vplivov ali segmentov, ki so kakorkoli dotično osebo pripeljali do tega. Malokateri berač ali klošar pobira od mimoidočih denar zato, da si kupi hrano ali oblačila ali podobno. Več ali manj za pijačo. Skoraj vsak dan lahko katerega srečam v mestu Maribor in tudi sam se odločim, pravzaprav iz načina življenja in zaradi tega, na kakšen način so bili pahnjeni v beračenje in klošarje, dam tudi kakšen tolar, pa dobro vem, za kaj gre. Naslednje, kar je. Ne morem pa mimo tega, da bi jim odvzeli pripomočke, predvsem iz enega preprostega razloga. Skoraj ni dneva ali ni tedna, da ne bi srečal gospoda tukaj pred parlamentom, na parkirišču, ki prodaja knjige. Posebno od njega, da zadovoljim njega, da dobi in da nekaj od mene zasluži, kupim štiri knjige. In to je najina kvota. Vsako leto po štiri. Verjetno ima nek zaslužek, pa verjemite mi, spoštovani kolegi in kolegice, da je dosti bolj pametno, da ta gospod tukaj pred parlamentom na parkirišču prodaja knjige, kot pa, da po trgovinah krade ali vlamlja ali kako drugače pridobiva sredstva za preživljanje. Amandmaja pod številko 2 ne morem podpreti. Je pa zaskrbljujoče, ko tisti, ki imamo parkirišče tukaj pred parlamentom, opazimo mlade osebe, mlade fante, ki stojijo pri blagajni, pa prosijo za drobiž, če komu ostane, ne zaradi tega, da mu daš, vprašaš se, zakaj je treba temu mlademu človeku, ki je star 20 ali 25 let, od jutra do večera stati pri blagajni in prosjačiti vse tiste, ki plačujejo parkirnino, za nekaj drobiža, da lahko tisti dan preživi. Za enimi stoji alkohol, za drugimi droga, za tretjimi pa verjetno ali po vsej verjetnosti razočaranje v življenju, ker so okoliščine, socialna katastrofa v družini ali podobno, privedla do tega, da je nekdo ostal brez strehe nad glavo, brez sredstev za preživljanje, pa verjetno tudi brez stalnega prebivališča in je na ta način pridobil status berača ali klošarja. Zato teh dveh amandmajev ne morem podpreti.",Negative,Negative,Non support. ,,,,False,Negative,Negative,Negative
